{
  "acquired_at": "2026-05-16T01:56:30Z",
  "actor": {
    "id": "claude-opus-4.7",
    "role": "manager"
  },
  "allowed_paths": [
    "docs/kernel-v2/"
  ],
  "branch": "task/T-OS-418-dogfood",
  "expires_at": "2026-05-16T02:26:30Z",
  "heartbeat_at": "2026-05-16T01:56:30Z",
  "lease_id": "LS-20260516T015630Z-T-OS-418-a5e8b48c",
  "notes": "release_reason=done",
  "released_at": "2026-05-16T01:56:40Z",
  "schema_version": "orgos.lease.v1",
  "status": "released",
  "task_id": "T-OS-418"
}
