{
  "acquired_at": "2026-06-13T05:30:48Z",
  "actor": {
    "id": "claude-manager",
    "role": "manager"
  },
  "allowed_paths": [
    "scripts/",
    ".orgos-manifest.yaml",
    "tests/kernel/",
    ".claude/commands/org-import.md",
    ".claude/settings.local.json",
    ".ai/RUNBOOKS/archive-tasks.md"
  ],
  "expires_at": "2026-06-13T06:00:48Z",
  "heartbeat_at": "2026-06-13T05:30:48Z",
  "lease_id": "LS-20260613T053048Z-T-OS-LAYOUT-R1R3-be49952e",
  "notes": "release_reason=done",
  "released_at": "2026-06-13T05:50:34Z",
  "schema_version": "orgos.lease.v1",
  "status": "released",
  "task_id": "T-OS-LAYOUT-R1R3"
}
