{
  "acquired_at": "2026-05-16T08:44:43Z",
  "actor": {
    "id": "claude-opus-4.7",
    "role": "manager"
  },
  "allowed_paths": [
    "scripts/org/deploy-kernel-v2.sh",
    "tests/kernel/test-deploy-kernel-v2.sh",
    ".ai/RUNBOOKS/shellcheck.md",
    ".ai/TASKS.yaml"
  ],
  "branch": "task/T-OS-431-batch",
  "expires_at": "2026-05-16T08:54:43Z",
  "heartbeat_at": "2026-05-16T08:44:43Z",
  "lease_id": "LS-20260516T084443Z-T-OS-431-f72c308f",
  "notes": "release_reason=cancelled",
  "released_at": "2026-05-16T09:02:47Z",
  "schema_version": "orgos.lease.v1",
  "status": "released",
  "task_id": "T-OS-431"
}
